,Unnamed: 0,Clinic_name,Ratings,Reviews,Num_Rating
0,0,Columbia University Fertility,5 star rating,"Columbia University Fertility center is an excellent fertility clinic as they have wonderful team of doctors. We were seen by Dr. Paula Brady at the Columbia University Clinic. She is an excellent doctor, who treats her patients at a very personal level. Dr. Brady took care of us and everything worked great for us.The Clinic as a whole is also very good as it is open to patients on holidays, weekends, and even the new year holiday. The entire team of Dr. Brady is very helpful, professional and listens to patient concerns with care and these issues are properly taken care off. Even when you call them at a very short notice, they get back to you quite quickly.I wish I could give them more than 5 stars and especially to Dr. Brady, who is an excellent consultant and above all a great human being. I would often bother her with issues, which may not be of great significance but she would always get back very quickly either through email or phone. She would even reply emails on Sundays. She considers her patients as humans, understands them and design the program accordingly for each patient individually based on the specific requirements of the patients. She prepares a road map for a patient and follow it up till the end, which I really liked about her. There is nothing ambiguous about her plan, she makes everything simple and clear.I would especially mention that even during this stressful Corona pandemic, she really managed everything so well and she ensured that I wasn't effected by it in anyway, for which I am really grateful to her. She is an expert of her field and very knowledgeable care provider in her field of expertise. One can be inspired in many ways from her.God has deputed some angels in the form of humans and she is one of those angels working to help distressed people at a very personal level. We felt honored to have been her patients. She makes you very comfortable during the entire procedure and ensures that you are not stressed during any phase in any way.While going through all this, you don't only need medications but you also need support and kind words from your medical team as well. So, when I felt low or felt nervous on some issue, I would contact Dr. Brady and she would reply that ""it's fine"" or ""it will get better"" or ""its pretty normal"" made me feel great, even if I were not feeling good earlier. These words may seem pretty simple in normal English but believe me, coming from your physician when you are in distress works wonder and Dr. Brady is great in communicating them in such a way that these lines would act as healer for me. The way Dr. Brady used to say those things made my body believe that ""its pretty normal"" and it is very important in this treatment.If anyone is considering a fertility program, I would sincerely advise to consult Columbia Fertility and look for Dr. Brady as she is the best resource. And one last advice, when you become her patient, trust on her judgement and her team and believe me "" It will get better"".",5
1,1,Columbia University Fertility,5 star rating,"There aren't enough words to describe how amazing Dr. Eric Forman and the staff at Columbia Fertility Center are. My husband and I have been trying to conceive for years but was not having any luck. It all changed when we met Dr. Forman. Dr. Forman broke down the process step by step for each procedure and made sure all was understood. Overall, the process was lengthy, but we were able to conceive on our first round of IVF. Dr. Forman always took his time explaining, answering our questions, and never made us feel rushed. I was able to contact Dr. Forman at any time and always received a quick reply whether by email or by phone.The atmosphere at Columbia Fertility Center is warm and welcoming. Its the nicest atmosphere I have ever experienced in a doctor's office.Thank you, Dr. Forman, for helping us become parents of an amazing baby boy.",5
2,2,Columbia University Fertility,5 star rating,"We had an amazing experience. First of all the whole place had a positive and light energy. The entire stuff was always smiling. Everyone was on point I didn't have to remind or explain anything to anyone. It felt like everything was done for us. No stress no confusion. We didn't know what to expect when we first decided to go to the fertility center. But honestly it all went so smooth and hustle free. I had no confusion I knew what to do next every step of the way. This was probably the most non-overwhelming doctor experience I have ever had. Long story short, after several months we had a successful IVF in the first try :) Every doctor we worked with was incredible but our favorite by far was Dr Brady. We are definitely coming back for baby #2 :) Dr Brady was incredibly knowledgeable, professional, supportive and super sweet. She was always in touch and her entire team was on top of everything. We were always updated the same day after our appointment. After such outstanding level of care and professionalism I decide to switch all my doctors to Columbia doctors!",5
3,3,Columbia University Fertility,5 star rating,"I had a great experience with Columbia Fertility  doctors and staff over a couple of years.  The staff was so friendly they felt like extended family while going through the ups and downs that can occur with fertility woes.  All who I interacted with were attentive and responsive- from the front desk staff, nursing staff, back office staff and the doctors.  Over the course of two years there were many who I interacted with and I would call out their names but I don't want to leave anyone out! It was a happy day to ""graduate"" and be released to my ob gyn with hugs and high fives from the staff and Dr Forman!  Fast forward to almost a year later and I'm a first time parent to a happy and healthy baby girl... thanks in part to the efforts of the former CWRC aka Columbia University Fertility. I'm happy to have chosen Columbia to address my fertility issues years ago!",5
4,4,Columbia University Fertility,5 star rating,"We had a wonderful experience at Columbia University Fertility Center. Dr Karipcin was amazing and we were lucky to have her. She's a caring and compassionate doctor.  She answered all my questions and concerns. She was very supportive of me going forward with IVF, so we felt very confident under her care. We will definitely go back to her if we decide to have a 2nd baby!",5
5,5,Columbia University Fertility,5 star rating,"My husband and I decided on Columbia after stumbling upon an insanely high review of Dr. Forman via a blog post (and then further review stalking on Fertility IQ). Dr. Forman and the entire Columbia Fertility staff are the nicest people you'll ever come across throughout your fertility journey. The office space is bright and clean, the employees are constantly smiling, no matter what time of day it is, and the communication process cannot be beat. The wait time for appointments is either nonexistent or extremely low considering other doctors offices I've been too. Dr. Forman is an open book and has the fastest response rate of pretty much anyone I've ever emailed with, period. No question is dumb or too small for him. He gets how stressful of a process this is for you and truly does everything he can to make you feel as comfortable and well informed as possible. A few specific logistical perks of Columbia are that they make morning monitoring appointments for you (as opposed to first come, first served, walk-in time frames which is how a lot of other places do it). Additionally, procedures are done on-site in the back surgical room (as opposed to going to the corresponding hospital which is also how other places seem to do it). Finally, instead of taking an injection class, we were able to sit down one-on-one with a nurse to go over the process. These are little things, but make a huge difference throughout the experience. No matter what route you end up taking to get pregnant, there are a ton of appointments involved. Columbia really has thought about all of the intricacies and has done a great job making it as streamlined as possible for patients. A million thank you's to every single person we crossed paths with at Columbia- we are forever grateful for all of you and will definitely be back for baby #2!",5
6,6,Columbia University Fertility,5 star rating,"It took us 4.5 years to get pregnant! I had some uterus issues, and we did 2 egg retrievals and 3 embryo transfers (3rd one worked!). We've been with Columbia this entire time, and couldn't be happier with our decision. They make you feel welcome, they are fast, and they communicate well. Of course there were bad days, hormonal days, sad days, but through it all my care team was supportive! The nurses smile at you and they try to all learn your name. Dr. Sinem Karipcin (Dr. K) was positive, warm, and laughed with us through the good and bad times! I could not recommend Columbia more. The only downside is that I WISH that Dr. K could be my OBGYN and deliver my baby!",5
7,7,Columbia University Fertility,1 star rating,Doctor was all talk no action.  Spends a lot of time detailing plans but then doesn't actually follow through.  No thanks for this place.,1
8,8,Columbia University Fertility,5 star rating,"My husband and I came to Columbia Fertility after having a terrible experience with another fertility doctor in Manhattan who made me feel old and defective. When we arrived at Columbia Fertility, we were impressed with the facility. It was welcoming, bright, and new, everything you want from a clinic. The receptionists were all nice and pleasant. The wait for appointments and morning monitoring was never long. The nurses and technicians became like friends. They were supportive and friendly, at a time when you really need to see a smile. Dr. Karipcin was our doctor and she was amazing. She is a smart, competent, and dedicated professional. She answered all our questions, answered our emails promptly, and was always positive. Once, when she was done with a procedure with a different patient, she quickly came to see me to personally review my ultrasound and speak to me. She is just a wonderfully compassionate and warm person. We were so lucky to have worked with her. She will always be a part of our family. We can't recommend her enough.",5
9,9,Columbia University Fertility,5 star rating,"We had a wonderful experience here, primarily because of dr Brady. From the very beginning till the end, she was very knowledgeable, attentive and considerate, and she was always easy to talk to and responded to our questions both in person and via email. Thank you doctor!",5
10,10,Columbia University Fertility,5 star rating,"The Columbia Fertility Center has been amazing! I started seeing them less than a year ago for IVF and they have been very helpful every step of the way. I was specifically a patient of Dr. Forman and his bedside manner is exceptional. I frequently emailed him serious and silly questions and he always answered quickly. In addition he makes it very clear that he cares about your overall health. Even on days he wasn't scheduled to perform certain procedures, he made it a point to be there anyway for his patients. During the monitoring phases of IVF you may not always see your doctor but that never made me feel uncomfortable because they were all warm and supportive of your concerns.  A lot of women use this center for their fertility and it's incredible how the office is able to manage it. I have never sat in the waiting room for a long time, even when it is busy. They are great!",5
11,11,Columbia University Fertility,5 star rating,"My husband and I had the good fortune of being connected to Dr Forman during our journey through conception. From the day we met with Dr Eric Forman it was all positive and promising. We have never met with a more attentive, caring, compassionate and empathic doctor and facility. Columbia university fertility center has the most inviting caregivers. We are blessed to be associated with them and Dr Forman. Both my husband and I have been very demanding in our attention from the doctor and his team and we got nothing short of it. Instead, they have given us more than promised at every appointment with respect to their time and answers to every question that we had. The best team to go to if you're looking for the right doctor for IVF. Can't thank you all enough.",5
12,12,Columbia University Fertility,5 star rating,I had a great experience with Columbia Fertility and would highly recommend to anyone. Dr. Rackow and my care team (nurse and care coordinator) were such a pleasure to work with and extremely thorough and informative. I felt like I was in great hands throughout my entire experience. The people at the front desk were always so friendly and helpful.,5
13,13,Columbia University Fertility,5 star rating,"Dr. McConnell was amazing. She was extremely patient with me, answering (in detail) any and numerous questions that crossed my mind. She is passionate about her work, she is rewarded internally when she experiences her patients become moms-to-be.My husband and I are extremely joyful that we had the experience to work with Dr. McConnell, as our fertility specialist. She paid close attention to my body through bloodwork, which directed her to give me an IVF treatment that was catered for my body. The IVF treatment plan worked. Currently we are expecting a healthy baby!!!!!!",5
14,14,Columbia University Fertility,5 star rating,"Dr. Forman and the team at Columbia are among the very best out there. Dr. Forman is the most responsive, accessible doctor I have ever worked with: he always answered emails within the day, sometimes within minutes, and he was willing to have lengthy phone conversations with me to go over any and every question I had. He is extremely knowledgeable and willing to share as much granular information as you need; I always felt I could question the particular reasoning behind a decision to understand it better but also trust his expertise. Dr. Forman always treated me as an individual, as he adjusted my protocols over the course of treatment to get better and better outcomes. While he seems a bit quiet and not super warm/fuzzy at first, he clearly cares about his patients--who else calls the evening before a retrieval to check if you have any last questions and wish you luck??--and goes above and beyond to help. The office also runs smoothly. I never had to wait more than ten minutes for morning monitoring--very important when you're squeezing these many appointments into the early hours before work! IVF is such a stressful experience, and you want to work with experts who will make it as manageable as possible. Can't recommend Dr. Forman highly enough.",5
15,15,Columbia University Fertility,5 star rating,"I cannot say enough good things about my experience with Dr. Forman and the team at Columbia's fertility center. I write this as my two week old naps. We began our journey nervous and very unsure of what to expect. Dr. Forman is everything you could want and more in a doctor. He was professional and informative but also explained everything in language that we could understand. He was positive and reassuring and was ALWAYS available to answer any and all questions. I felt bad emailing him on the weekends because I knew that he would answer within hours and I did not want to take him away from his family. Dr. Forman checked in with the office and emailed me while on his vacation to tell me that my blood test results were positive and that the IVF round was successful. This communication is above and beyond and the whole team at Columbia never made me feel like there was a silly or stupid question. Being a teacher, the monitoring hours worked for me and they were able to accommodate me by giving me one of the first appointments. There were some days that I waited longer than usual to be seen but it did not happen often. While there are many women that go through their offices every day, every doctor and nurse cares about the individual patient. Over the course of my journey, I got to know the staff so well that I felt sad leaving to my regular obgyn. I continued my pregnancy with Columbia doctors and continued to have a great experience. I have recommended Columbia fertility to many people and we are eternally grateful for everything they have done for us.",5
16,16,Columbia University Fertility,5 star rating,"Dr. Rachel McConnell is an outstanding physician. She gives you hope and leaves you feeling confident in her capable and caring hands. We have our family thanks to her!! The new Westchester location is beautiful, state of the art, and conveniently located. And the staff are equally as caring and helpful. We are forever grateful for their help in growing our family!",5
17,17,Columbia University Fertility,5 star rating,"We came to Columbia after reading the positive reviews on Fertility IQ, particularly for Dr. Forman. The reviews have proven to be spot on. Dr. Forman is caring and highly communicative (no other doctor has ever emailed me to keep me informed at each stage), and really takes all the delicate factors (labs, insurance, age, etc.) of a patient's unique profile into consideration. The Columbia team as a whole has been wonderful - from the front desk, to the nurses, to the staff who coordinate medications, everyone has been professional and sensitive, and things have moved along seamlessly. Infertility is physically and emotionally draining, but my husband and I have been able to relax somewhat knowing that they have everything under control here.",5
18,18,Columbia University Fertility,5 star rating,"I cannot say enough great things about this practice. I had a wonderful experience at Columbia Fertility from consultation to conception. As a high risk patient, I was very nervous about finding the right doctor who understood my condition and I had the extremely good fortune of being connected with Dr. Brady who could not have been more caring and thorough. She is *extremely* knowledgeable, answered all of my questions, and has a very comforting bedside manner which is so important. Me and my husband both felt confident that we were in the best hands possible. The office staff, nurses, care coordinators -- they are all so kind and attentive (and the office itself is very relaxing + clean.)",5
19,19,Columbia University Fertility,5 star rating,"Loved all the staff at Columbia University Fertility. They were very helpful and compassionate. From the very first step of receiving information to the end of my process, Dr. Brady along with her team, Sherry and Varda, truly made me feel very comfortable and made the journey much easier.",5
20,20,Columbia University Fertility,5 star rating,"I am extremely happy with this center.  The staff are always courteous and Dr. Paula Brady is amazing.  She has an excellent bedside manner and takes time to explain everything with her patients.  I went for a routine visit and had a general question and she went through the history of my chart to respond in a way that was suited for my individual program.  She really seems to care about her patients and makes sure to go beyond to make sure you are comfortable throughout the entire process.  I have been to 3 different centers and this is by far the most thorough, most courteous, caring and treats each patient as though you are their only patient.",5
21,21,Columbia University Fertility,1 star rating,"They have attempted to re-brand themselves with a new office and new Yelp page, but this is the same old crappy CWRC with a new name. After leaving this agency, I went to New Hope Fertility Center and I'm finally pregnant. I went to Columbia in July 2018, paid over $13K up front for a cycle that ended up not working, and fast forward to Dec 2018/Jan 2019 and I'm still receiving bills from them! It seems like Columbia is trying to double dip! They collected my money up front, and then tried to bill my insurance too. On top of  trying to charge me for monitoring services that I previously paid for before the start of the cycle, they are trying to charge me $1200 for frozen embryos that aren't even normal. Just got off the phone with their billing person and he couldn't even explain why I was receiving bills and told me to call the fixer or customer service person at Columbia. Of course, no one answered the phone upon me calling.p.s. I don't blame Columbia for my cycle not working. Maybe it just wasn't my month. But, I do blame them for not having their billing situation together. I don't need any stress in my life during this pregnancy. Yet, every time I see a false bill from them my stress level goes up. It's really not acceptable.",1
22,22,Columbia University Fertility,5 star rating,I went to this office for the first time mainly due to seeing Jen the pheblemist in the elevator. She expressed to me come up to the penthouse and check it out. I am so happy thus far I did. Also the front desk is so professional and resourceful.Jessica and Edelith was very polite and sensitive towards me knowing the reason why I am coming to see the doctor. Words cannot express my gratitude to Jen.....,5
23,23,Columbia University Fertility,5 star rating,"Dr Forman was one of the best doctors I've every encountered in my life. Incredibly knowledgeable, attentive and warm.",5
24,24,Columbia University Fertility,5 star rating,"I've been a patient here for about a year and can't say enough good things. Dr Forman is the best Doctor.  He's pragmatic, kind,compassionate, so responsive, and super on top of everything. Every person that works here is truly wonderful. The people at the reception desk are amazing. The wait is minimal if at all. They really try to get you in and out as easily as possible. Jenny who takes your blood is so kind and skilled and such a pleasure. The nurses are great. I will be forever grateful to all of these people for everything they've done for me.",5
25,25,Columbia University Fertility,5 star rating,"I would like to recommend Dr. Rogerio Lobo as he is one of the most polite and patient doctor that I have come across. He is also very knowledgeable and would not simply just recommend any invasive procedures. He listens very well to his patient's needs and provide sound advice. I just had my baby girl and if it wasn't for his advice and care, I would not have gone thru some of the challenges and have our beautiful daughter. Thank you Dr. Lobo!",5
26,26,Columbia University Fertility,5 star rating,"Dr. Forman listened to my concerns and is very good with first time IVF patients. Nothing was too small for his attention and he's always doing his best for you. He consistently went above and beyond for me the entire time I was in his care. A perfect example of this was when I had expressed how much I wanted him to perform the actual IVF procedure rather than another doctor from the clinic. The day of the procedure, it wasn't guaranteed that he could make it but he rushed to the clinic and made it happen. I actually teared up when I saw him. These things mean the world to women who have no control over their bad fortune.He and his team understood that these things mattered and what a difference it makes when your concerns are taken seriously. Even the front desk and nurses who draw blood exhibited the same standard of care. Peri, the Egg Donor Program Coordinator, is especially great. She was incredibly helpful and reliable.I can't recommend Columbia University Fertility Center enough.",5
27,27,Columbia University Fertility,5 star rating,"Dr. Williams is the most amazing Dr. He is kind, caring and compassionate. I would highly recommend him and his practice.Everybody is very kind and caring. They are very attentive and available when you need them.He takes his time getting to know you and your needs.",5
28,28,Columbia University Fertility,5 star rating,"We have partnered with Dr Rachel McConnell and so beyond happy with her. She was so patient and  answered all of our questions in detail and thoughtfully always. She paid attention to my bloodwork and scans and was spot on and made sure my protocol fit me. After less than a yr with her we are finally pregnant and graduated from the facility. It was bittersweet and felt strange as we have bonded and felt at home with everyone. Her staff In Scarsdale and the city were just the best. They always made sure they called/emailed me with any information and results and were very sympathetic. I mean from Antoinette from billing to Katrina and Nicole were just always on point. I never felt like just the ""next"" patient but truly like they cared. The morning monitoring was always so prompt in both offices as well. They truly made the experience better as tough as this is experience is. I could go on and on but honestly Dr McConnell was simply the best and so knowledgeable especially with any ideas I brought to her attention. Thank you and I hope to see everyone with my double rainbow baby. Fingers crossed!",5
29,29,Columbia University Fertility,5 star rating,"I live in New Hampshire and feel so incredibly grateful to have been referred to the Columbia University Fertility Center and Dr. Williams. The care that I received from Dr. Williams and his team was unlike any other. They were caring, kind, brilliant, and progressive. Dr. Williams made himself available to me during all hours of the day and expressed the most sincere, intent care. I rarely find a doctor who I feel is just as invested in my case as I am, and Dr. Williams and the group exceeded all of my expectations. From the front desk staff, to the billing team, to the clinical team, we were blown away. Thank you all for all that you have done for our family!  We are truly, truly grateful!",5
